{
  "authoritative_tree_modified": false,
  "disposable": true,
  "files": [
    {
      "authoritative_sha256": "e7fc42918a05d516291d4f55f5151ec594d433d00844cab6d1ece7b7b8ba9e08",
      "companion_sha256": "46decccbc8e7ac15a19bedd58acd4b01ca9f696cfb4bd5e76afcbb17d9962b63",
      "modified_for_probe": true,
      "path": "harness.c",
      "role": "candidate-harness",
      "size_bytes": 507
    },
    {
      "authoritative_sha256": "b3c0cf01f55f7c98cf820b67ccaceb62e1f22ed9e91a4f717d642cda3223eb5b",
      "companion_sha256": "b3c0cf01f55f7c98cf820b67ccaceb62e1f22ed9e91a4f717d642cda3223eb5b",
      "modified_for_probe": false,
      "path": "include/vector.h",
      "role": "header",
      "size_bytes": 119
    },
    {
      "authoritative_sha256": "c9cfd7cfb0c5d07b07d7853efdcd1b6b9b923c2425d7f2b018dd3f79e289ab59",
      "companion_sha256": "c9cfd7cfb0c5d07b07d7853efdcd1b6b9b923c2425d7f2b018dd3f79e289ab59",
      "modified_for_probe": false,
      "path": "src/vector.c",
      "role": "production-source",
      "size_bytes": 179
    }
  ],
  "insertion": {
    "anchor_line": "__CPROVER_assert(result[0] == left[0] - right[0], \"component zero\");",
    "inserted_cover_line_number": 21,
    "insertion_position": "before",
    "marker_begin": "V5_NONVACUITY_PROBE_BEGIN:assertion-location",
    "marker_end": "V5_NONVACUITY_PROBE_END:assertion-location",
    "matching_anchor_count": 1,
    "original_anchor_line_number": 20,
    "probe_id": "assertion-location",
    "selected_occurrence": 1,
    "source_path": "harness.c"
  },
  "schema_version": "1.0",
  "skill_version": "1.0.0-rc1"
}
